title,idS,idP
Biocompatible and sustainable power supply for self-powered wearable and implantable electronics using III-nitride thin-film-based flexible piezoelectric generator,s264,p264
Nonlinear resonant ultrasound spectroscopy of stress corrosion cracking in stainless steel rods,s265,p265
Roadmap on biological pathways for electronic nanofabrication and materials,s266,p266
Impact of soft errors on large-scale FPGA cloud computing,s267,p267
On-chip FPGA debug instrumentation for machine learning applications,s268,p268
Measuring the transverse Young's modulus of maize rind and pith tissues,s269,p269
Configuration estimation for accurate position control of large-scale soft robots,s270,p270
Influence of micro-structured superhydrophobic surfaces on nucleation and natural convection in a heated pool,s271,p271
Target control and source estimation metrics for dynamical networks,s272,p272
Surveying the Landscape: Statewide Data on K-12 CS Education Implementation,s273,p273
Dynamics of a capsule flowing in a tube under pulsatile flow,s274,p274
Failure time distributions for complex equipment,s275,p275
An intuitive way to understand mutual coupling effects in antenna arrays using the poynting streamline method,s276,p276
A 9-Bit 10-MHz 28-μW SAR ADC Using Tapered Bit Periods and a Partially Interdigitated DAC,s277,p277
Reduced-order modeling through machine learning and graph-theoretic approaches for brittle fracture applications,s278,p278
Necessary and Sufficient Conditions on State Transformations That Preserve the Causal Structure of LTI Dynamical Networks,s279,p279
"Dynamic Networks: Representations, Abstractions, and Well-Posedness",s280,p280
Alpha Model Domination in Multiple Choice Learning,s281,p281
Static structures in leaky mode waveguides,s282,p282
Origami fold states: Concept and design tool,s283,p283
Geometrically Motivated Reparameterization for Identifiability Analysis in Power Systems Models,s284,p284
Product development: Principles and tools for creating desirable and transferable designs,s285,p285
"Combined trajectory, propulsion and battery mass optimization for solar-regenerative high-altitude long endurance unmanned aircraft",s286,p286
The effect of communication and vehicle properties on the search performance of a swarm of unmanned aerial vehicles,s287,p287
Simulating stall inception in a high-performance fan using createt m-av kestrel,s288,p288
Microfluidic temperature behavior in a multi-material 3D printed chip,s289,p289
Takeoff and performance trade-offs of retrofit distributed electric propulsion for urban transport,s290,p290
Identifying mode shapes of turbo-machinery blades using principal component analysis and support vector machines,s291,p291
New uses of instagram in design history education,s292,p292
Exploring play interventions in design education,s293,p293
"Exploring the moral differences, between industrial design, engineering and entrepreneurship students",s294,p294
Progress on static structures for leaky mode waveguides,s295,p295
Polarization-resolved single-photon measurements of nonlinear Thomson scattering,s296,p296
The personification of big data,s297,p297
Cooperating in long-term relationships with time-varying structure,s298,p298
Modeling pressurized dense phase coal fluidization and transport,s299,p299
A usability study of five two-factor authentication methods,s300,p300
Improving photophoretic trap volumetric displays [Invited],s301,p301
Designing emergent swarm behaviors using behavior trees and grammatical evolution,s302,p302
"Is that you, Alice? A usability study of the authentication ceremony of secure messaging applications",s303,p303
Analyzing the safety impacts of raised medians,s304,p304
Action needed! Helping users find and complete the authentication ceremony in signal,s305,p305
When is a tree really a truck? Exploring mental models of encryption,s306,p306
Frequency response of the leap motion controller and its suitability for measuring tremor,s307,p307
DFT-based frequency offset estimators for 16-APSK,s308,p308
Doppler power spectra from vehicle-to-everything propagation experiments,s309,p309
Analysis of inertial measurement data from a model rocket payload,s310,p310
On carrier frequency and phase synchronization for coded 16-APSK in aeronautical mobile telemetry,s311,p311
Polarization diversity and equalization of frequency selective channels in telemetry environment for 16APSK,s312,p312
Characterization and validation of in situ void formation during resin infusion,s313,p313
Characteristics of self-deployment in origami-based systems,s314,p314
Deployable euler spiral connectors (DESCs),s315,p315
Cylindrical developable mechanisms for minimally invasive surgical instruments,s316,p316
Factors leading to sustainable social impact on the affected communities of engineering service learning projects,s317,p317
Conceptualizing stable states in origami-based devices using an energy visualization approach,s318,p318
Thick folding through regionally-sandwiched compliant sheets,s319,p319
Benefits of a short-term engineering study abroad: A survey of students over the past 15 years,s320,p320
Kirigami-based deployable transcrease hard stop models usable in origami patterns,s321,p321
Fabrication and testing of a MEMS system for injection of DNA into plant cells,s322,p322
Machine learning for evaluating the social impact of engineered products: A framework,s323,p323
Simulation of a micro-electro-mechanical system for generating electrical power from pressurized gas,s324,p324
Establishing baseline performance for off-the-shelf nitrile seals for the India Mark II hand pump system,s325,p325
Advances in Signal Processing for Friction Stir Welding Temperature Control,s326,p326
Dynamic optimization of high-altitude solar aircraft trajectories under station-keeping constraints,s327,p327
A neutral XML design framework for generating parametric parts in multiple CAD systems,s328,p328
Measurement of radiative gas and particle emissions in biomass flames,s329,p329
3D printed selectable dilution mixer pumps,s330,p330
Using ellipsometry and X-ray photoelectron spectroscopy for real-time monitoring of the oxidation of aluminum mirrors protected by ultrathin MgF2 layers,s331,p331
3D printing for lab-on-a-chip devices with 20 μm channels,s332,p332
Best practices for wake model and optimization algorithm selection in wind farm layout optimization,s333,p333
Comparison of wind farm layout optimization results using a simple wake model and gradient-based optimization to large-eddy simulations,s334,p334
Thermal properties of thin film uranium oxides and thorium oxides,s335,p335
Effects of laser ablation parameters to pattern high purity magnesium surfaces,s336,p336
Radial variation in distortion transfer and generation in a highly loaded fan stage from near-stall to choke,s337,p337
Evaluation and demonstration of take home laboratory kit,s338,p338
A Proposed Test to Evaluate Efflorescence Potential of Ceramic Blocks,s339,p339
Increasing Inducer Stability and Suction Performance With a Stability Control Device,s340,p340
Relative Heading Estimation and Its Application in Target Handoff in GPS-Denied Environments,s341,p341
One-dimensional turbulence modelling of a lifted methane/air jet flame in a vitiated coflow,s342,p342
Changes in perceptions of ethical climate among undergraduate engineering students,s343,p343
"“Something isn't secure, but I'm not sure how that translates into a problem”: Promoting autonomy by designing for understanding in Signal",s344,p344
A methodology for analyzing intersection safety,s345,p345
Safe2Ditch: Emergency landing for small unmanned aircraft systems,s346,p346
Single particle detection enhancement with wavelet-based signal processing technique,s347,p347
A comparative usability study of key management in secure email,s348,p348
Passive Force-Deflection Curves for Controlled Low-Strength Material (CLSM) and Lightweight Cellular Concrete (LCC),s349,p349
Enhanced Detection of Single Viruses On-Chip via Hydrodynamic Focusing,s350,p350
User attitudes toward the inspection of encrypted traffic,s351,p351
Weighing Context and Trade-offs: How suburban adults selected their online security posture,s352,p352
Do capstone students really understand the needs of the customer?: Observations on students’ blind spots left by early program curriculum,s353,p353
The technology/tactics (TEC/TAC) plot: Explicit representation of user actions in the product design space,s354,p354
The spectral line weighted-sum-of-gray-gases (SLW) model for prediction of radiative transfer in molecular gases,s355,p355
Closed-Loop PID Re-Tuning in a Digital Twin by Re-Playing Past Setpoint and Load Disturbance Data,s356,p356
Measurements and modeling of fluid flow and thermal processes in an industrial precalciner,s357,p357
Using a Product's Sustainability Space as a Design Exploration Tool,s358,p358
Broadband antireflective light-blocking layer using nanoparticle suspension in photoresist with high-resolution patterning,s359,p359
A CAD assembly simplification approach with ray casting,s360,p360
Overestimation of liquefaction hazard in areas of low to moderate seismicity due to improper characterization of probabilistic seismic loading,s361,p361
Strategies for Removing Common Mode Failures from TMR Designs Deployed on SRAM FPGAs,s362,p362
High surface-area carbon microcantilevers,s363,p363
Experimental characterization of leaky-mode spatial light modulators fabricated via direct laser writing,s364,p364
Multi-timescale pump-probe spectroscopy using time-encoding and time-stretching methods,s365,p365
Accelerating high-throughput searches for new alloys with active learning of interatomic potentials,s366,p366
"Self-deployable, self-stiffening, and retractable origami-based arrays for spacecraft",s367,p367
Development and testing of an innovative architectural programming simulation as a precursor to target value design,s368,p368
Adaptive control of large-scale soft robot manipulators with unknown payloads,s369,p369
Three-way spectral decompositions of high-performance military aircraft noise,s370,p370
The Sobrado Vallim Rehabilitation Project,s371,p371
Expanding the far UV range of aluminum-coated mirrors for space-based observations to reflect hydrogen Lyman lines via fluoride multilayers,s372,p372
Crackle-related beamforming of military jet aircraft noise,s373,p373
Coherence analysis of the noise from a simulated highly-heated laboratory-scale jet,s374,p374
The fog of warnings: How non-essential notifications blur with security warnings,s375,p375
Testing and analysis of masonry hollow clay block prisms filled with mortar,s376,p376
A robust ensemble feature selector based on rank aggregation for developing new VO2max prediction models using support vector machines,s377,p377
Optofluidic platform with integrated optical waveguides and sample preparation for digitized detection of nucleic acid targets,s378,p378
Data-driven dynamic equivalents for power system areas from boundary measurements,s379,p379
Regular 2D and 3D linkage-based origami tessellations,s380,p380
Rigidly foldable thick origami using designed-offset linkages,s381,p381
"Compositional MRI of the Hip: Reproducibility, Effect of Joint Unloading, and Comparison of T2 Relaxometry with Delayed Gadolinium-Enhanced Magnetic Resonance Imaging of Cartilage",s382,p382
Developable mechanisms on developable surfaces,s383,p383
Review of surface water interactions with metal oxide nanoparticles,s384,p384
Microcontroller compiler-assisted software fault tolerance,s385,p385
Selective hardening for neural networks in FPGAs,s386,p386
Adhesion testing of printed inks while varying the surface treatment of polymer substrates,s387,p387
High-acquisition-rate single-shot pump-probe measurement using chirped-fiber Bragg gratings,s388,p388
Numerical analyses of mortar incorporating the variation in Poisson’s ratio with increasing axial load,s389,p389
A design approach to fully compliant multistable mechanisms employing a single bistable mechanism,s390,p390
When official systems overload: A framework for finding social media calls for help during evacuations,s391,p391
Orthogonal liquid-jet impingement on wettability-patterned impermeable substrates,s392,p392
Folding approaches for tensioned precision planar shell structures,s393,p393
"Mexico City Basin Effects: Past, Present, and Future",s394,p394
Requirements for software to support the use of social media in emergency management: A Delphi study,s395,p395
Preface,s396,p396
The winds and currents mission concept,s397,p397
Locally correlated slw model for prediction of gas radiation in non-uniform media,s398,p398
Accuracy of engineering methods for radiative transfer in CO2-H2O mixtures at high temperature,s399,p399
Assessment of engineering gas radiative property models in high pressure turbulent jet diffusion flames,s400,p400
"Creating open source models, test cases, and data for oilfield drilling challenges",s401,p401
Traverses for the ISECG-GER design reference mission for humans on the lunar surface,s402,p402
Simultaneous Global Identification of Dynamic and Network Parameters in Transient Stability Studies,s403,p403
Neutron Radiation Beam Results for the Xilinx UltraScale+ MPSoC,s404,p404
Single-Event Characterization of 16 nm FinFET Xilinx UltraScale+ Devices with Heavy Ion and Neutron Irradiation,s405,p405
Influence of Communication Irregularities and Co-simulation on Hybrid Power System State Estimation,s406,p406
Integration of sample preparation and analysis into an optofluidic chip for multi-target disease detection,s407,p407
Evaluating Safety Impacts of Access Management Alternatives with the Surrogate Safety Assessment Model,s408,p408
Regional Stiffness Reduction Using Lamina Emergent Torsional Joints for Flexible Printed Circuit Board Design,s409,p409
Influence of microstructure geometry on pool boiling at superhydrophobic surfaces,s410,p410
Feasibility of induced pluripotent stem cell therapies for treatment of type 1 diabetes,s411,p411
A model for multi-input mechanical advantage in origami-based mechanisms,s412,p412
Symmetric Equations for Evaluating Maximum Torsion Stress of Rectangular Beams in Compliant Mechanisms,s413,p413
Spectrum allocations: The aeronautical telemetry story in the USA,s414,p414
Submerged hydraulic jump remediation at low-head dams: Partial width deflector design,s415,p415
Investigating Strategies for Pre-Class Content Learning in a Flipped Classroom,s416,p416
Simulated Microstructural and Compositional Evolution of U-Pu-Zr Alloys Using the Potts-Phase Field Modeling Technique,s417,p417
"The effect of two distinct fast time scales in the rotating, stratified Boussinesq equations: variations from quasi-geostrophy",s418,p418
A cost-effective approach to realization of the efficient methane chemical-looping combustion by using coal fly ash as a support for oxygen carrier,s419,p419
Exploration and evaluation of CAD modeling in virtual reality,s420,p420
An optical method for the measurement of combustion gas temperature in particle laden flows,s421,p421
Thermally induced atomization during droplet impingement on superheated hydrophobic and superhydrophobic surfaces,s422,p422
Carlitz–Wan conjecture for permutation polynomials and Weill bound for curves over finite fields,s423,p423
Error correction in structured optical receivers,s424,p424
Column axial load effects on the performance of skewed SMF RBS connections,s425,p425
Tutorial on interpreting x-ray photoelectron spectroscopy survey spectra: Questions and answers on spectra from the atomic layer deposition of Al2O3 on silicon,s426,p426
FleCSPH: A parallel and distributed smoothed particle hydrodynamics framework based on FleCSI,s427,p427
Controlling normal stiffness in droplet-based linear bearings,s428,p428
Using physical and functional comparisons to assure 3rd-party IP for modern FPGAs,s429,p429
"Reengineering cell-free protein synthesis as a biosensor: Biosensing with transcription, translation, and protein-folding",s430,p430
Performance comparison of low temperature and chemical absorption carbon capture processes in response to dynamic electricity demand and price profiles,s431,p431
Flexural strength and stiffness of block-out connections for steel columns,s432,p432
CIP2A immunosensor comprised of vertically-aligned carbon nanotube interdigitated electrodes towards point-of-care oral cancer screening,s433,p433
"Active Topology Inference in Store, Code, and Forward Networks",s434,p434
On peak-to-average power ratio optimization for coded APSK,s435,p435
Cryptanalysis of Lempel-Ziv Compressed and Encrypted Text: The Statistics of Compression,s436,p436
Erratum: Hardware and software improvements to a low-cost horizontal parallax holographic video monitor (Applied Optics (2018) 57 (A122-A133) DOI: 10 1364/AO 57 00A122),s437,p437
Identification and Prioritization of Critical Subject Matter within Mechanical Systems Curriculum in Construction Management Education,s438,p438
The emerging impact of cell-free chemical biosynthesis,s439,p439
Efficiency of Generalized Regular k-point grids,s440,p440
Rapid Operational Access and Maneuver Support platform for military logistics and operation planning in water environments,s441,p441
Lead sulfide quantum dots inside ferritin: synthesis and application to photovoltaics,s442,p442
A pseudo-static model for dynamic analysis on frequency domain of distributed compliant mechanisms,s443,p443
Corrigendum: Efficient decellularization of whole porcine kidneys improves reseeded cell behavior (Biomedical Materials (Bristol) (2016) 11 (025003) DOI: 10 1088/1748-6041/11/2/025003),s444,p444
Effect of strain path on forming limits and retained austenite transformation in Q&P 1180 steel,s445,p445
Deployable lenticular stiffeners for origami-inspired mechanisms,s446,p446
Engineering attitudes: an investigation of the effect of literature on student attitudes toward engineering,s447,p447
Total hemispherical apparent radiative properties of the infinite V-groove with specular reflection,s448,p448
Synthesis of high-specific volume carbon nanotube structures for gas-phase applications,s449,p449
Natural frequencies of piled raft foundation including superstructure effect,s450,p450
Biomechanical modeling of prosthetic mesh and human tissue surrogate interaction,s451,p451
Autonomous target following with monocular camera on UAS using Recursive-RANSAC tracker,s452,p452
Learned Search Parameters for Cooperating Vehicles using Gaussian Process Regressions,s453,p453
Zipper Tube Reinforcement to Mitigate Flexible Shaft Buckling,s454,p454
Modified Material Properties in Curved Panels Through Lamina Emergent Torsional Joints,s455,p455
An Origami-based Thickness-Accommodating Bistable Mechanism in Monolithic Thick-sheet Materials,s456,p456
Implementation of Rolling Contacts for SORCE Joints,s457,p457
The PepSeq Pipeline: Software for Antimicrobial Motif Discovery in Randomly-Generated Peptide Libraries,s458,p458
Buried Rib SiO2 Multimode Interference Waveguides for Optofluidic Multiplexing,s459,p459
Improved Track Continuity in Multi Target Tracking by Fusing Multiple Input Sources,s460,p460
Visual Multiple Target Tracking from a Descending Aerial Platform,s461,p461
A Class of Logistic Functions for Approximating State-Inclusive Koopman Operators,s462,p462
Extending Motion Detection to Track Stopped Objects in Visual Multi-Target Tracking,s463,p463
Movie recommendations using the deep learning approach,s464,p464
A graduate school recommendation system using the multi-class support vector machine and KNN approaches,s465,p465
Relative Navigation: A Keyframe-Based Approach for Observable GPS-Degraded Navigation,s466,p466
One-dimensional turbulence modeling for cylindrical and spherical flows: model formulation and application,s467,p467
Developable compliant-aided rolling-contact mechanisms,s468,p468
A Rateless Approach to Physical-Layer Security,s469,p469
Nested QPSK Encoding for Information Theoretic Security,s470,p470
A Tale of Two Studies: The Best and Worst of YubiKey Usability,s471,p471
Radiative properties of gases,s472,p472
The Future of R&D Leadership: Wider changes in the culture and the market will drive changes in the practice of R&D leadership ,s473,p473
Mining social media divides: an analysis of K-12 U S  School uses of Twitter,s474,p474
Design and characterization of a package-less hybrid PDMS-CMOS-FR4 contact-imaging system for microfluidic integration,s475,p475
Secure Array Synthesis in Multipath Channels,s476,p476
Comparison of calibrated empirical and semi-empirical methods for bedload transport rate prediction in gravel bed streams,s477,p477
A Multimodal Exploration of Engineering Students' Emotions and Electrodermal Activity in Design Activities,s478,p478
Kinetostatic modeling of complex compliant mechanisms with serial-parallel substructures: A semi-analytical matrix displacement method,s479,p479
Solar system science with the Wide-Field Infrared Survey Telescope,s480,p480
"3D printed microfluidic features using dose control in X, Y, and Z dimensions",s481,p481
A cognitive approach to predicting academic success in computing,s482,p482
Increasing student construction interest by engaging elementary students in an inquiry-based 3D modelling after school program,s483,p483
Outreach potential of displaying research artifacts in art museums,s484,p484
Intensive mentoring and micro-electronics research for students in engineering (IMMERSE),s485,p485
Transitioning a manufacturing systems engineering course to student-centered learning,s486,p486
Assessment of a global engineering outreach course,s487,p487
Understanding engineering and technology student perceptions: Barriers to study abroad participation,s488,p488
Designing a sustainable large-scale project-based learning (PBL) experience for juniors in electrical and computer engineering,s489,p489
Investigating influences on first-year engineering students' views of ethics and social responsibility,s490,p490
A longitudinal study of social and ethical responsibility among undergraduate engineering students: Comparing baseline and midpoint survey results,s491,p491
Lowman's model goes back to the movies,s492,p492
Crafting the future of computing education in CC2020: A workshop,s493,p493
Preface,s494,p494
Crystallographic Reconstruction of Parent Austenite Twin Boundaries in a Lath Martensitic Steel,s495,p495
Bézier B̄ projection,s496,p496
Relative visual-inertial odometry for fixed-wing aircraft in GPS-denied environments,s497,p497
Direct Measurement of High-Gain and Complementary Charge-Steering Amplifiers,s498,p498
Twining and dynamic recrystallization in austenitic Alloy 718 during friction welding,s499,p499
Bubble nucleation in superhydrophobic microchannels due to subcritical heating,s500,p500
Measuring User Perceptions of Popular Transportation Project Delivery Methods Using Least Significant Difference Intervals and Multiple Range Tests,s501,p501
Optimized ARROW-Based MMI Waveguides for High Fidelity Excitation Patterns for Optofluidic Multiplexing,s502,p502
Membrane-Enhanced Lamina Emergent Torsional Joints for Surrogate Folds,s503,p503
High-Strength Concrete Masonry Walls under Concentric and Eccentric Loadings,s504,p504
Inverse piezoresistive nanocomposite sensors for identifying human sitting posture,s505,p505
Shaping and Forming of Advanced High Strength Steels,s506,p506
Volumetric displays,s507,p507
Systems analysis of EV adoption and criteria pollutant accumulation during inversion events,s508,p508
ENIGMA military brain injury: A coordinated meta-analysis of diffusion MRI from multiple cohorts,s509,p509
"Midtarsal locking, the windlass mechanism, and running strike pattern: A kinematic and kinetic assessment",s510,p510
Noise reduction techniques in fiber optic sensors,s511,p511
Fabrication of High Aspect Ratio Millimeter-Tall Free-Standing Carbon Nanotube-Based Microelectrode Arrays,s512,p512
A bi-directional interface for improved interaction with engineering models in virtual reality design reviews,s513,p513
Non-dimensional modeling of the effects of weld parameters on peak temperature and cooling rate in friction stir welding,s514,p514
Isogeometric Bézier dual mortaring: Refineable higher-order spline dual bases and weakly continuous geometry,s515,p515
Estimated Time of Restoration (ETR) Guidance for Electric Distribution Networks,s516,p516
Effect of environmental and material factors on the response of nanocomposite foam impact sensors,s517,p517
Low Temperature Oxidative Dehydrogenation of Ethane by Ce-Modified NiNb Catalysts,s518,p518
Evans function computation for the stability of travelling waves,s519,p519
Scalable fabric tactile sensor arrays for soft bodies,s520,p520
Effectiveness of an Immersive Virtual Environment for Collaboration with Gesture Support Using Low-Cost Hardware,s521,p521
Antireflective light-blocking layers using a liquid top matte coating,s522,p522
Vertical electrical impedance testing of a concrete bridge deck using a rolling probe,s523,p523
Rigidly foldable quadrilateral meshes from angle arrays,s524,p524
Toward a Universal Social Impact Metric for Engineered Products That Alleviate Poverty,s525,p525
Dual-wavelength reflectance spectroscopy of the superior vena cava: A method for placing central venous catheters at the cavoatrial junction,s526,p526
Investigating the safety impact of roadway network features of suburban arterials in Shanghai,s527,p527
Information geometry for model identification and parameter estimation in renewable energy - DFIG plant case,s528,p528
Predicting the maximum endurance time for left-side bridge exercise using machine learning methods and hybrid data,s529,p529
CrsRecs: A personalized course recommendation system for college students,s530,p530
Using tripartite graphs to make long tail recommendations,s531,p531
Texture mediated grain boundary network design in three dimensions,s532,p532
