title,idS,idP
Lab-scale observations of flame attachment on slopes with implications for firefighter safety zones,s533,p533
Swarm Transparency,s534,p534
"Geotechnical extreme-event reconnaissance (GEER) investigation to the 2016 Mw 6 0, Mw 6 2 and Mw 7 0 Kumamoto Japan Earthquakes",s535,p535
"3D printed high density, reversible, chip-to-chip microfluidic interconnects",s536,p536
The Locational Impact of Site-Specific PEGylation: Streamlined Screening with Cell-Free Protein Expression and Coarse-Grain Simulation,s537,p537
Architecture exploration for HLS-oriented FPGA debug overlays,s538,p538
Computational Modeling of Wound Suture: A Review,s539,p539
A dual sensor selective for Hg2+ and cysteine detection,s540,p540
Hybrid power system state estimation with irregular sampling,s541,p541
On the well-posedness of LTI networks,s542,p542
Necessary and sufficient conditions for identifiability of interconnected subsystems,s543,p543
Local control and estimation performance in dynamical networks: Structural and graph-theoretic results,s544,p544
A comparative analysis of computer-aided design team performance with collaboration software,s545,p545
Materials selection of flexible open-cell foams in energy absorption applications,s546,p546
"Grain structure evolution, grain boundary sliding and material flow resistance in friction welding of Alloy 718",s547,p547
Hybrid state transactional database for product lifecycle management features in a multi-engineer synchronous heterogeneous CAD environment,s548,p548
Moment method analysis of a reconfigurable OTA reverberation chamber,s549,p549
Rapid visualization of compressor blade finite element models using surrogate modeling,s550,p550
Development of a vortex particle code for the modeling of wake interaction in distributed propulsion,s551,p551
Evaluation of curve fitting techniques for estimating time of surcharge release in embankment construction over soft soils,s552,p552
Multidisciplinary design optimization of flexible solar-regenerative high-altitude long-endurance aircraft,s553,p553
Distributed electric propulsion effects on traditional aircraft through multidisciplinary optimization,s554,p554
Mixing plane simulation of a high-performance fan using kestrel,s555,p555
Practical Superdirectivity with Resonant Screened Apertures Motivated by a Poynting Streamlines Analysis,s556,p556
The secure socket API: TLS as an operating system service,s557,p557
3D printed microfluidic selectable ratio mixer pump in 2 mm3,s558,p558
Sediment management in U S  reservoirs: Challenges and progress [Gestion des sédiments dans les retenues américaines: Défis et progrès],s559,p559
Thermal diffusivity measurements with fluorescent scanning microscope,s560,p560
Open source computational photonics toolbox,s561,p561
Progress on photophoretic trap displays,s562,p562
Demonstration of interference pattern structured illumination imaging,s563,p563
Using instagram to increase student engagement with design history,s564,p564
Increasing the educational impact following a field study programme,s565,p565
Information reduction and studio project frameworks,s566,p566
GEESE: Grammatical evolution algorithm for evolution of swarm behaviors,s567,p567
Modeling and using secondary taste terms,s568,p568
"Exploration of three dimensional, hierarchical, large scale UAV system interactions",s569,p569
High Accuracy Achieved in Determining Lengths and Locations of Horizontal Curves Using Light Detection and Ranging Point Cloud Data,s570,p570
Hardware and software improvements to a low-cost horizontal parallax holographic video monitor,s571,p571
"A review of friction stir welding of steels: Tool, material flow, microstructure, and properties",s572,p572
Solid state crack repair by friction stir processing in 304L stainless steel,s573,p573
On the performance of filter based equalizers for 16apsk in aeronautical telemetry environment,s574,p574
Physical-layer security for aeronautical telemetry,s575,p575
Femtosats: Elegant flight telemetry payloads for model rockets,s576,p576
Byu mars rover at the 2018 university rover challenge,s577,p577
Eliminating wiring in aircraft instrumentation through energy harvesting,s578,p578
Adaptive net radiative heat transfer and thermal management with origami-structured surfaces,s579,p579
Three approaches for managing stiffness in origami-inspired mechanisms,s580,p580
Origami-based design of conceal-and-reveal systems,s581,p581
Automating the design of thick-origami mechanisms,s582,p582
Retractable anti-buckling support systems for flexible medical devices,s583,p583
"Social impact in product design, an exploration of current industry practices",s584,p584
Over-design versus redesign as a response to future requirements,s585,p585
Design and modeling of a prosthetic venous valve,s586,p586
Patterned carbon nanotube growth on stainless steel,s587,p587
Dynamic SEU Sensitivity of Designs on Two 28-nm SRAM-Based FPGA Architectures,s588,p588
Total hemispherical apparent radiative properties of the infinite V-Groove with diffuse reflection,s589,p589
Architectures for Earth-observing CubeSat scatterometers,s590,p590
Volumetric display by movement of particles trapped in a laser via photophoresis,s591,p591
When does a human replan? Exploring intent-based replanning in multi-objective path planning,s592,p592
A compact low-cost direction finding system for unmanned aerial vehicles,s593,p593
Evaluation and optimization of dynamic cone penetration test (DPT) for assessment of liquefaction in gravelly soils,s594,p594
Radial variation in distortion transfer and generation through a highly loaded fan stage,s595,p595
Universal airfoil parametrization using B-splines,s596,p596
Analysis of distortion transfer and generation through a compressor using the harmonic balance approach,s597,p597
A Review of Thickness-Accommodation Techniques in Origami-Inspired Engineering,s598,p598
"Closure to ""discussion of 'a review of thickness-accommodation techniques in origami-inspired engineering'"" (Lang, R  J , Tolman, K  A , Crampton, E  B , Magleby, S  P , and Howell, L  L , 2018, ASME Appl  Mech  Rev , 70(1), p  010805)",s599,p599
Cylindrical cross-axis flexural pivots,s600,p600
Strut-and-tie models for masonry walls with openings,s601,p601
Finite element model of dry-stack masonry shear walls,s602,p602
An investigation of self-efficacy and topic emotions in entry-level engineering design learning activities,s603,p603
Pull-out strength of fiberglass/epoxy composite rebar manufactured using a three-dimensional braiding process,s604,p604
Collaboration task-technology fit for student distributed engineering design teams,s605,p605
Comparing in Situ Soil Water Characteristic Curves to Those Generated in the Lab,s606,p606
High fidelity MMI excitation patterns for optofluidic multiplexing,s607,p607
3D hydrodynamic focusing for optofluidics using a stacked channel design,s608,p608
Lateral resistance of piles within corrugated metal sleeves,s609,p609
Analysis of post-liquefaction axial capacities of driven pile and drilled shaft foundations,s610,p610
Gravelly Soil Liquefaction after the 2016 Ecuador Earthquake,s611,p611
Evaluation of Dynamic Cone Penetration Test for Liquefaction Assessment of Gravels from Case Histories in Idaho,s612,p612
Optimization of Grid Spacing Pattern for the Development of Reference Parameter Maps for Liquefaction-Induced Free-Field Settlement,s613,p613
Integrating community-level data resources for precision medicine research,s614,p614
Initial Comparisons of Friction Stir Spot Welding and Self Piercing Riveting of Ultra-Thin Steel Sheet,s615,p615
Benefits of two turbine rotor diameters and hub heights in the same wind farm,s616,p616
Profile-based team organization in multi-university capstone engineering design teams,s617,p617
Unification of signal models for soqpsk,s618,p618
Cfo estimation by exploiting channel sparsity in aeronautical telemetry,s619,p619
Time reversal techniques,s620,p620
Simplified modeling for soot formation from solid fuels,s621,p621
Targeted 3D modeling from UAV imagery,s622,p622
Spatiotemporal correlation analysis of jet noise from a round-nozzle supersonic aircraft,s623,p623
Dependence of high-performance military aircraft noise on frequency and engine power,s624,p624
Inclusion of broadband shock-associated noise in spectral decomposition of noise from highperformance military aircraft,s625,p625
Comparison of noise from high-performance military aircraft for ground run-up and flyover operations,s626,p626
Large-scale multidisciplinary optimization of an electric aircraft for on-demand mobility,s627,p627
Guest Editorial Special Issue on Marine and Maritime Radar Remote Sensing,s628,p628
New flow assurance system with high speed subsea fiber optic monitoring of pressure and temperature,s629,p629
Information design in crowdfunding under thresholding policies,s630,p630
Environmental and track factors that contribute to abrasion damage,s631,p631
"Blast-Induced Liquefaction Results at the Silty-Sand Site of Mirabello, Emilia Romagna Region, Italy",s632,p632
"Simplified Evaluation of the Seismic Failure of an Old Wharf during the 2014 Mw 8 2 Pisagua, Chile, Earthquake",s633,p633
Folding approaches for tensioned precision planar shell structures,s634,p634
A modeling framework for assessing cyber disruptions and attacks to the national airspace system,s635,p635
Puzzling the pieces: Conceptual blocks of engineering student ideas in a service learning project,s636,p636
Local texture evolution and mechanical performance of ultra-high-speed friction stir weld of AA 6111-T4 sheets,s637,p637
"High-Speed Friction Stir Welding of AA7075-T6 Sheet: Microstructure, Mechanical Properties, Micro-texture, and Thermal History",s638,p638
Commissioning observations with the focal L-band Array on the Green Bank Telescope (FLAG),s639,p639
Effect of nozzle–plate distance on acoustic phenomena from supersonic impinging jet,s640,p640
Progress in transparent flat-panel holographic displays enabled by guided-wave acousto-optics,s641,p641
A graph-theoretic understanding of network-wide implications of local cyber protections for mission assurance,s642,p642
"Factor analysis in automated face detection: Gender, occlusion, eyewear, brightness, contrast, and focus measure",s643,p643
Numerical analyses of mortar incorporating the variation in poisson's ratio with increasing axial load,s644,p644
In-situ measurements of strain in soft body armor with FBG sensors during ballistic impacts,s645,p645
Application of “CODeve” methodology in transatlantic student design project,s646,p646
Development and testing of a friction-based post-installable fiber-optic monitoring system for subsea applications,s647,p647
Fixing the O&M Budget with Asset Management to Create More Capital Debt Capacity for Pipe Projects,s648,p648
From lignocellulose to biocomposite: Multi-level modelling and experimental investigation of the thermal properties of kenaf fiber reinforced composites based on constituent materials,s649,p649
Improving full-scale models of new carbon capture technologies with uncertainty quantification,s650,p650
Ground-based sense-and-avoid system for small unmanned aircraft,s651,p651
Defining a Sustainable Underground Infrastructure Framework: ISO Asset Management and ISO Life Cycle,s652,p652
How Green Are You? Economic and Environmental Sustainability: Assessing the Global Warming Potential (GMP) of Your Underground Infrastructure,s653,p653
Lateral Resistance of Abutment Piles Near Mechanically Stabilized Earth Walls,s654,p654
Benchmarking your break rates: A review of new findings and trends from north American water main break studies,s655,p655
Human factors in mission control centers,s656,p656
Design of a clinical decision support system for fracture prediction using imbalanced dataset,s657,p657
Water main criticality scoring and GIS centric risk mitigation: Applying GIS spatial analysis tools and apps for greater insight for high risk underground infrastructure,s658,p658
"Alluvial and fluvial fans on Saturn's moon Titan reveal processes, materials and regional geology",s659,p659
Alternative diffusion anisotropy measures for the investigation of white matter alterations in 22q11 2 deletion syndrome,s660,p660
Informing the use of hyperparameter optimization through metalearning,s661,p661
Deep visual gravity vector detection for unmanned aircraft attitude estimation,s662,p662
New Vapor-Pressure Prediction with Improved Thermodynamic Consistency using the Riedel Equation,s663,p663
Bias estimation for angle-only sensors in distributed multi-target tracking systems,s664,p664
Sidelobe Level and Aperture Efficiency Optimization for Tiled Aperiodic Array Antennas,s665,p665
Nano-Composite Foam Sensor System in Football Helmets,s666,p666
Effects of Laryngeal Activity on Articulation,s667,p667
Discovering the building blocks of atomic systems using machine learning: Application to grain boundaries,s668,p668
A Comparison of Indoor MIMO Measurements and Ray-Tracing at 24 and 2 55 GHz,s669,p669
Multidimensional Stability of Large-Amplitude Navier–Stokes Shocks,s670,p670
Water supply damage caused by the 2016 Kumamoto Earthquake,s671,p671
Plain-Style Preferences of US Professionals,s672,p672
Analysis of the external radiation from circular cylindrical shells,s673,p673
Antenna Loss and Receiving Efficiency for Mutually Coupled Arrays,s674,p674
Continuous permeability measurement during unidirectional vacuum infusion processing,s675,p675
"High-Precision, Mixed-Signal Mismatch Measurement of Metal-Oxide-Metal Capacitors",s676,p676
A 3D isogeometric BE–FE analysis with dynamic remeshing for the simulation of a deformable particle in shear flows,s677,p677
High-Speed Interrogation of Multiplexed Fiber Bragg Gratings with Spectral Distortion,s678,p678
Layering Security at Global Control Points to Secure Unmodified Software,s679,p679
Polyethylene Glycol Based Changes to β-Sheet Protein Conformational and Proteolytic Stability Depend on Conjugation Strategy and Location,s680,p680
Dynamic grouping of cooperating vehicles using a receding horizon controller for ground target search and track missions,s681,p681
Applying a passive network reconstruction technique to Twitter data in order to identify trend setters,s682,p682
Selective Laser Melting aluminum waveguide attenuation at K-band,s683,p683
Use of Personality Profile Assessments in the U S  Commercial Construction Industry,s684,p684
Simulations in Construction and Engineering Management Education to Explore Professional Challenges,s685,p685
A comparison of model predictive control and PID temperature control in friction stir welding,s686,p686
Use of Hi-resolution data for evaluating accuracy of traffic volume counts collected by microwave sensors,s687,p687
Review of research on student-facing learning analytics dashboards and educational recommender systems,s688,p688
Design for excess capability to handle uncertain product requirements in a developing world setting,s689,p689
Mitigated FPGA design of multi-gigabit transceivers for application in high radiation environments of High Energy Physics experiments,s690,p690
An ultra-high Q inductorless narrowband filter based on the voltage divider phase shift method,s691,p691
SAE Aero Design East: BYU-Idaho Aero Team 326 - Final Report Document,s692,p692
Custom 3D printer and resin for 18 μm × 20 μm microfluidic flow channels,s693,p693
Estimation of 3D Ground Reaction Force Using Nanocomposite Piezo-Responsive Foam Sensors During Walking,s694,p694
"The need, development, and validation of the innovation test instrument",s695,p695
A Review of the Capabilities of Current Low-Cost Virtual Reality Technology and Its Potential to Enhance the Design Process,s696,p696
Inferring ascending auction participation from observed bidders,s697,p697
Differential effects of air conditioning type on residential endotoxin levels in a semi-arid climate,s698,p698
Inverted L-arm gripper compliant mechanism,s699,p699
A multi-user computer-aided design competition: Experimental findings and analysis of team-member dynamics,s700,p700
Diagnostic and prognostic value of delayed Gadolinium Enhanced Magnetic Resonance Imaging of Cartilage (dGEMRIC) in early osteoarthritis of the hip,s701,p701
"The human touch: How non-expert users perceive, interpret, and fix topic models",s702,p702
Shear joy of watching paint dry,s703,p703
Bad news first: How optimal directness depends on what is negated,s704,p704
Non-perturbing voltage measurement in a coaxial cable with slab-coupled optical sensors,s705,p705
Optofluidic lab-on-a-chip fluorescence sensor using integrated buried ARROW (bARROW) waveguides,s706,p706
Toward quantitative characterization of essential tremor for future tremor suppression,s707,p707
Water entry of deformable spheres,s708,p708
Generating derivative superstructures for systems with high configurational freedom,s709,p709
Improved Antenna Efficiency Measurement Uncertainty in a Reverberation Chamber at Millimeter-Wave Frequencies,s710,p710
Space-Time Coding for Aeronautical Telemetry: Part i - Estimators,s711,p711
Space-Time Coding for Aeronautical Telemetry: Part II - Decoder and System Performance,s712,p712
Process responses and resultant joint properties of friction stir welding of dissimilar 5083 and 6061aluminum alloys,s713,p713
The AFLOW Library of Crystallographic Prototypes: Part 1,s714,p714
Methods for determining the optimal number of simultaneous contributors for multi-user CAD parts,s715,p715
Counter UAS using a formation controlled dragnet,s716,p716
Variable stiffness adaptation to mitigate system failure in inflatable robots,s717,p717
"Multi-objective design optimization of a soft, pneumatic robot",s718,p718
Motion planning for mobile robots using inverse kinematics branching,s719,p719
SAE Aero Design East: BYU-Idaho Aero Team 326 - Final Report Document,s720,p720
"Move the Laser Spot, Not the DUT: Investigating the New Micro-mirror Capability and Challenges for Localizing SEE Sites on Large Modern ICs",s721,p721
Dynamic SEE Testing of Selected Architectural Features of Xilinx 28 nm Virtex-7 FPGAs,s722,p722
A Systems Engineering Approach to Harnessing Human Energy in Public Places: A Feasibility Study,s723,p723
Modeling global and local codon bias with deep language models,s724,p724
Carbon monolith scaffolding for high volumetric capacity silicon Li-ion battery anodes,s725,p725
Strategies employed and lessons learned by commercial construction companies during economic recession and recovery,s726,p726
Whole genome phylogenetic tree reconstruction using colored de bruijn graphs,s727,p727
Genome polymorphism detection through relaxed de bruijn graph construction,s728,p728
Cooperation induction in two player bertand markets with linear demand,s729,p729
Student perceptions and attitudes towards a required vs  An optional course in leadership,s730,p730
Technology and design programs,s731,p731
Experiential learning: Using small-scale projects to teach project complexities and relationship roles in construction,s732,p732
Cross platform usability: Evaluating computing tasks performed on multiple platforms,s733,p733
Sustainable water filters in southern Peru,s734,p734
Global humanitarian-based projects: A documentation strategy for strengthening project sustainability,s735,p735
Project-based learning curriculum for the junior year based on building a laser tag system,s736,p736
A model workshop for helping new faculty engage students in the STEM Classroom,s737,p737
Investigating engineering students' understandings of social and ethical responsibility: Coding framework and initial findings,s738,p738
Analytical fragility curves for non-skewed highway bridges in Chile,s739,p739
Optical electric field sensor sensitivity direction rerouting and enhancement using a passive integrated dipole antenna,s740,p740
Associative CAD references in the neutral parametric canonical form,s741,p741
Design of low-power ultra-high voltage gain differential cascode stages,s742,p742
Village Drill: A Case Study in Engineering for Global Development with Five Years of Data Post Market-Introduction,s743,p743
Simulation-based coefficients for adjusting climate impact on energy consumption of commercial buildings,s744,p744
"Hierarchically refined and coarsened splines for moving interface problems, with particular application to phase-field models of prostate tumor growth",s745,p745
Enabling Dissimilar Material Joining Using Friction Stir Scribe Technology,s746,p746
Simulation and exploration of high-density unmanned aerial vehicle systems,s747,p747
An RVE procedure for micromechanical prediction of mechanical behavior of dual-phase steel,s748,p748
Mitigating Water Absorption in Waveguides Made from Unannealed PECVD SiO2,s749,p749
Multiplexed efficient on-chip sample preparation and sensitive amplification-free detection of Ebola virus,s750,p750
Semi-empirical Model for Fire Spread in Shrubs with Spatially-Defined Fuel Elements and Flames,s751,p751
Using vegetation management and LiDAR-derived tree height data to improve outage predictions for electric utilities,s752,p752
Measurement-Directed Reduction of Dynamic Models in Power Systems,s753,p753
Behavior of Sheet Metal Under Multiaxial Deformation Paths,s754,p754
Pathology-targeted cell delivery via injectable micro-scaffold capsule mediated by endogenous TGase,s755,p755
Microstructure Correlation with Formability for Biaxial Stretching of Magnesium Alloy AZ31B at Mildly Elevated Temperatures,s756,p756
Tuning Ferritin's band gap through mixed metal oxide nanoparticle formation,s757,p757
Permanganate-based synthesis of manganese oxide nanoparticles in ferritin,s758,p758
"Pseudo-singleton pattern and agnostic business layer for multi-engineer, synchronous, heterogeneous CAD",s759,p759
Thermal characterization of natural and synthetic spider silks by both the 3ω and transient electrothermal methods,s760,p760
Fundamental Principles of Tremor Propagation in the Upper Limb,s761,p761
Thick rigidly foldable origami mechanisms based on synchronized offset rolling contact elements,s762,p762
Planning and Analyzing Experiments with Models that Distinguish Between Replicates and Repeats,s763,p763
"A Geometrically Exact Isogeometric Blended Shell: Formulation, Benchmarking, and Automotive Application",s764,p764
Design and Evaluation of Adverb Palette: A GUI for Selecting Tradeoffs in Multi-objective Optimization Problems,s765,p765
Haptic Shape-Based Management of Robot Teams in Cordon and Patrol,s766,p766
Ground-based 3D radar imaging of trees using a 2D synthetic aperture,s767,p767
Overview of estimation methods for industrial dynamic systems,s768,p768
Reservoir sustainability and sediment management,s769,p769
Infrastructure Project Scope Definition Using Project Definition Rating Index,s770,p770
Evaluation of stochastic particle dispersion modeling in turbulent round jets,s771,p771
Effect of tool geometry and process parameters on mechanical properties of friction stir spot welded dissimilar aluminum alloys,s772,p772
Nonparametric Tree-Based Predictive Modeling of Storm Outages on an Electric Distribution Network,s773,p773
Status of elementary teacher development: Preparing elementary teachers to deliver technology and engineering experiences,s774,p774
"Strength, behavior, and failure mode of hollow concrete masonry constructed with mortars of different strengths",s775,p775
Three-dimensional microscopic light field particle image velocimetry,s776,p776
"Theoretical estimates of maximum fields in superconducting resonant radio frequency cavities: Stability theory, disorder, and laminates",s777,p777
In-situ grain structure and texture evolution during friction stir welding of austenite stainless steel,s778,p778
"Poynting Streamlines, Effective Area Shape, and the Design of Superdirective Antennas",s779,p779
Structural analysis and optimization of tall buildings connected with skybridges and atria,s780,p780
Comparison and Analysis of Recursive-RANSAC for Multiple Target Tracking,s781,p781
Light splitting with imperfect wave plates,s782,p782
Comprehensive and quality-controlled bedload transport database,s783,p783
Active Integrated Antenna Supporting Linear and Circular Polarizations,s784,p784
Stability of Viscous St  Venant Roll Waves: From Onset to Infinite Froude Number Limit,s785,p785
MMI waveguide based multispectral detection of nucleic acids for analysis of drug-resistant bacteria,s786,p786
Design and characterization of integrated 2D ABEL trap,s787,p787
"A well clear recommendation for small UAS in high-density, ADS-B-enabled airspace",s788,p788
Formation of deposits from heavy fuel oil ash in an Accelerated Deposition Facility at temperatures up to 1206°C,s789,p789
Predicting efficiency of a turbine driven by pulsing flow,s790,p790
Mixed-integer multi-objective optimization applied to the PCS design of the I 2S-LWR,s791,p791
In situ bubble characterization during resin infusion for process simulation of voids,s792,p792
TrustBase: An architecture to repair and strengthen certificate-based authentication,s793,p793
Relative target estimation using a cascade of extended Kalman filters,s794,p794
Introducing second-Year students to concept-Based projects for increased success in third-Year sponsored projects,s795,p795
Sell it: Design project assessment by the public,s796,p796
Design education and the new culture of design centric intellectual property,s797,p797
Integrating a multidisciplinary design methods mindset into classroom practice,s798,p798
Using local invasive species and flora to manufacture collagen based biodegradable plastic tableware,s799,p799
Extension of the QuikSCAT Sea Ice Extent Data Set with OSCAT Data,s800,p800
Semi-empirical model for fire spread in chamise and big sagebrush shrubs with spatially-defined fuel elements and flames,s801,p801
Investigation of merging flames in horizontal and vertical geometries,s802,p802
